{
  "monthly_rent_total": 1500,
  "rent_share_fraction": 0.5,
  "tenancy_months": 12,
  "tas_score": 692,
  "credit_events": {
    "declared_ccjs": [
      {
        "amount": 250,
        "satisfied": true
      }
    ],
    "declared_iva": false,
    "declared_bankruptcy": false,
    "undeclared_adverse_found": false,
    "has_score": true
  },
  "id_check": {
    "passed": true,
    "document_fraud": false,
    "proof_of_residency_received": true
  },
  "aml_pep_sanctions": {
    "sanctions_match": false,
    "pep": false,
    "aml_adverse": false
  },
  "income": {
    "type": "employed",
    "gross_annual": 45000,
    "start_in_days": 0,
    "contract": "permanent",
    "professional_role": false,
    "self_employed_years": 0,
    "independent_means": {
      "has_proof": false,
      "funds_for_term": 0
    }
  },
  "landlord_ref": {
    "received": true,
    "arrears": "none",
    "property_care": "good",
    "notes": ""
  },
  "bank_validation_present": true,
  "needs_rent_protection_underwriting": false
}